{
  "project_name": "BB-Translation",
  "project_description": "Pipeline dịch tài liệu ngành bánh (sách, tạp chí, ebook) EN→VI, giữ nguyên layout, hỗ trợ glossary chuyên ngành",
  "phase": "build",
  "version": "1.3.2",
  "released_at": "2026-09-10",
  "updated_at": "2026-09-13",
  "team": {
    "persistent": [
      "pm",
      "ba",
      "tech-lead",
      "dev",
      "reviewer",
      "qa"
    ],
    "checkpoint_experts": [
      "domain-expert",
      "critic"
    ]
  },
  "documents": {
    "prd": "docs/PRD.md",
    "architecture": "docs/Architecture.md",
    "design_log": "docs/design-log.md",
    "changelog": "docs/CHANGELOG.md",
    "review_report": "docs/review-report.md",
    "test_report": "docs/test-report.md",
    "escalation_log": "docs/escalation-log.md",
    "decisions_archive": "docs/decisions-archive.md",
    "expert_notes_dir": "docs/expert-notes/",
    "archive_dir": "docs/archive/"
  },
  "checkpoints": [
    {
      "id": "C1",
      "document": "docs/PRD.md",
      "status": "approved",
      "approved_version": "2.0",
      "approved_commit": "d946e0cc1a370f67221e37d6ee016169ac96f445",
      "approved_at": "2026-09-11",
      "current_version": "2.0",
      "status_reason": "Hiếu duyệt lại baseline v2.0 trong chat 2026-09-11 — approved_commit điền sau khi commit đổi header, xem docs/design-log.md"
    },
    {
      "id": "C2",
      "document": "docs/Architecture.md",
      "status": "approved",
      "approved_version": "2.0",
      "approved_commit": "d946e0cc1a370f67221e37d6ee016169ac96f445",
      "approved_at": "2026-09-11",
      "current_version": "2.0",
      "status_reason": "Hiếu duyệt lại baseline v2.0 trong chat 2026-09-11 — approved_commit điền sau khi commit đổi header, xem docs/design-log.md"
    }
  ],
  "open_questions": [
    {
      "id": "HOI-01",
      "text": "Cấp CLAUDE_API_KEY/GEMINI_API_KEY thật để chạy spike rate-limit AIMD, hay chấp nhận để nhánh Claude/Gemini ở trạng thái [UNVERIFIED]?",
      "asked_by": "pm",
      "origin": "blockers[] cũ B2 — Architecture.md §6.12.6",
      "blocks": [],
      "default": "Giữ [UNVERIFIED], chỉ dùng DeepSeek/Ollama cho job thật — không chặn release",
      "status": "answered",
      "answered_in": "docs/design-log.md — Final Decision 2026-09-11: Hiếu xác nhận chưa cấp API thật, giữ [UNVERIFIED] (= mặc định)",
      "clarify_rounds": 1
    },
    {
      "id": "HOI-02",
      "text": "Bug #6: overlay chữ xoay không bao giờ kích hoạt cho nhánh pdf_scan + babeldoc (OCR bridge làm phẳng góc). Thiết kế lại nguồn lấy góc xoay, hay chấp nhận giới hạn?",
      "asked_by": "qa",
      "origin": "blockers[] cũ B5 — CHANGELOG.md:4545, chạm 5/5 vòng Protocol 3",
      "blocks": [],
      "default": "Ghi nhận là giới hạn đã biết của nhánh pdf_scan, không mở thêm vòng Dev-QA",
      "status": "answered",
      "answered_in": "docs/design-log.md — Final Decision 2026-09-11: chưa có kế hoạch dùng PDF scan, chấp nhận giới hạn (mặc định)",
      "clarify_rounds": 1
    },
    {
      "id": "HOI-03",
      "text": "US-22 EPUB: đã fix 3 biến thể JSON malformed từ DeepSeek nhưng biến thể mới vẫn có thể xuất hiện. Chốt hướng dài hạn nào trong 4 phương án ở escalation-log?",
      "asked_by": "pm",
      "origin": "blockers[] cũ B10 — docs/escalation-log.md",
      "blocks": [],
      "default": "Phương án 1 — giảm EPUB_REQUEST_CHAR_BUDGET và đo thật trước khi đầu tư đổi format",
      "status": "answered",
      "answered_in": "docs/design-log.md — Final Decision 2026-09-11: Hiếu chọn Phương án 1 (= mặc định)",
      "clarify_rounds": 1
    },
    {
      "id": "HOI-04",
      "text": "Bug #EPUB-5 (S4): tắt thinking mode của DeepSeek cho nhánh EPUB (epub_disable_thinking=True, K-3 Architecture.md §6.20.15) để output_tokens không còn lẫn token suy luận gây runaway giả?",
      "asked_by": "tech-lead",
      "origin": "docs/Architecture.md §6.20.15 K-3, docs/design-log.md RCA Bug #EPUB-5",
      "blocks": ["S4"],
      "default": "Bật tắt thinking cho nhánh EPUB — đổi chi phí output giảm mạnh, đánh đổi chất lượng dịch câu khó có thể giảm nhẹ",
      "status": "answered",
      "answered_in": "docs/design-log.md — Final Decision 2026-09-11: Hiếu chọn tắt thinking cho EPUB (= mặc định)",
      "clarify_rounds": 1
    },
    {
      "id": "HOI-05",
      "text": "Bug #EPUB-5 (S4): chấp nhận bóc id=\"kobo.*\" khỏi output EPUB (K-1) để tránh Bug #5-kiểu-mới ở write_translated() đếm lệch slot? Hệ quả đo được: 0/7.616 id được tham chiếu, chỉ ảnh hưởng phân trang lại trên máy đọc Kobo.",
      "asked_by": "tech-lead",
      "origin": "docs/Architecture.md §6.20.15 K-1, docs/design-log.md RCA Bug #EPUB-5",
      "blocks": ["S4"],
      "default": "Chấp nhận bóc — không id nào bị tham chiếu, chỉ mất phân trang lại của riêng máy Kobo",
      "status": "answered",
      "answered_in": "docs/design-log.md — Final Decision 2026-09-11: Hiếu chọn chấp nhận bóc koboSpan (= mặc định)",
      "clarify_rounds": 1
    },
    {
      "id": "HOI-06",
      "text": "Chốt luật: mọi chỉ thị '⚠️ ASSUMED — phải đo lại ở lần chạy live đầu' bắt buộc có mục backlog[] kèm owner, không chỉ nằm trong văn bản (root cause quy trình Bug #EPUB-5, xem design-log.md)?",
      "asked_by": "tech-lead",
      "origin": "docs/design-log.md RCA Bug #EPUB-5 — quan sát quy trình",
      "blocks": [],
      "default": "Chốt luật — thêm vào CLAUDE.md project dưới dạng mở rộng Protocol 5",
      "status": "answered",
      "answered_in": "CLAUDE.md project — R5-06 (PM ghi trực tiếp 2026-09-11, tài liệu governance)",
      "clarify_rounds": 1
    },
    {
      "id": "HOI-07",
      "text": "BL-12: chọn Phương án D (normalize mimetype khi ghi output + reject sớm thứ không sửa được) hay giữ strict?",
      "asked_by": "tech-lead",
      "origin": "docs/design-log.md §4 bảng phương án — điều tra BL-12",
      "blocks": ["S4"],
      "default": "Phương án D",
      "status": "answered",
      "answered_in": "design-log.md — Final Decision 2026-09-16: chọn Phương án D",
      "clarify_rounds": 1
    },
    {
      "id": "HOI-08",
      "text": "BL-12: EPUB thiếu hẳn mimetype/sai content-type — reject sớm hay tự chế entry mimetype chuẩn?",
      "asked_by": "tech-lead",
      "origin": "docs/design-log.md §4 — ranh giới sửa-được/không-sửa-được",
      "blocks": ["S4"],
      "default": "Reject sớm",
      "status": "answered",
      "answered_in": "design-log.md — Final Decision 2026-09-16: chọn reject sớm (R8-02)",
      "clarify_rounds": 1
    },
    {
      "id": "HOI-09",
      "text": "Tính năng mới FR→VI: phạm vi định dạng, glossary, UI chọn source language, ưu tiên so với BL-12?",
      "asked_by": "pm",
      "origin": "Yêu cầu Hiếu trong chat 2026-09-16",
      "blocks": [],
      "default": "PDF+EPUB, dùng chung glossary EN hiện có, auto-detect ngôn ngữ nguồn, làm sau khi BL-12/S4 xong",
      "status": "answered",
      "answered_in": "Chat 2026-09-16: PDF+EPUB, glossary EN dùng chung, auto-detect source lang, sau BL-12",
      "clarify_rounds": 1
    },
    {
      "id": "HOI-10",
      "text": "Tính năng mới: loại bỏ trang claim bản quyền trước khi xuất file dịch — cách nhận diện, phạm vi, xử lý sai sót?",
      "asked_by": "pm",
      "origin": "Yêu cầu Hiếu trong chat 2026-09-16",
      "blocks": [],
      "default": "Auto-detect bằng heuristic, áp dụng PDF+EPUB, chấp nhận rủi ro v1 và ghi backlog cải thiện sau",
      "status": "answered",
      "answered_in": "Chat 2026-09-16: auto-detect heuristic, PDF+EPUB, chấp nhận rủi ro v1",
      "clarify_rounds": 1
    },
    {
      "id": "HOI-11",
      "text": "S8-Q1: ca EPUB mà xoá trang bản quyền có nguy cơ hỏng cấu trúc file (doc bị nhiều nơi trỏ tới) — luôn xoá hay giữ nguyên khi không an toàn?",
      "asked_by": "tech-lead",
      "origin": "docs/design-log.md §6 — thiết kế S8, ngoài phạm vi HOI-10",
      "blocks": [],
      "default": "Không an toàn thì giữ nguyên trang (không dịch nó) thay vì xuất file có nguy cơ hỏng — PM áp dụng mặc định, không chặn Dev, gộp xác nhận với Hiếu ở đợt CLARIFY sau",
      "status": "answered",
      "answered_in": "PM áp dụng mặc định 2026-09-17 (không chặn, Protocol B — gộp đợt sau nếu Hiếu muốn đổi)",
      "clarify_rounds": 1
    }
  ],
  "backlog": [
    {
      "id": "BL-01",
      "text": "font_shrink_page() lặp qua toàn bộ tài liệu thay vì phạm vi riêng của chunk (lãng phí tính toán sau fix Bug #7)",
      "source": "reviewer",
      "ref": "src/core/job_orchestrator.py ~550-554 — DONE: 2026-09-10, Dev→Reviewer APPROVE→QA live PASS (77 lần gọi thay vì 455, đúng phạm vi chunk)",
      "status": "done"
    },
    {
      "id": "BL-02",
      "text": "create_job(): duplicate-check chạy TRƯỚC cost gate — request không có force=true trả duplicate_found trước khi chạm cost gate",
      "source": "qa",
      "ref": "docs/test-report.md — QA Vòng 7 — DONE: 2026-09-10, đảo thứ tự cost gate trước duplicate-check, QA live verify qua TestClient",
      "status": "done"
    },
    {
      "id": "BL-03",
      "text": "Thiếu test round-trip cho field ollama_thread qua API (field đã expose đúng ở settings.py)",
      "source": "qa",
      "ref": "tests/integration/test_settings_api.py — DONE: 2026-09-10, thêm test round-trip PUT/GET, QA live verify",
      "status": "done"
    },
    {
      "id": "BL-04",
      "text": "DONE 2026-09-11: babeldoc giờ ghi LayoutQaFinding khi tự drop đoạn (kênh 1/unfit). Qua 2 vòng Domain Expert, Dev implement, Reviewer APPROVE, QA PASS ready_for_release YES",
      "source": "domain-expert",
      "ref": "docs/Architecture.md §6.22, docs/test-report.md 'BL-04 QA Vòng 1', docs/review-report.md 'BL-04 Implementation VÒNG 1/3'",
      "status": "done"
    },
    {
      "id": "BL-05",
      "text": "chunk.api_cost/api_tokens_used không được ghi trước khi raise qua EpubBatchTranslationError và EpubRequestRunawayError",
      "source": "reviewer",